행번호,제목,내용,등록자,시기,지역,인물,출처
1,의정부지구 전투,"상세설명   1. 의정부지구 전투의 개요    본 전투는 1950년 6월 26일, 한국전쟁 발발 당시에 서울 북쪽 17km의 의정부 정면에서 유재흥 준장이 지휘하는 제 7사단과 이형근 준장이 지휘하는 제 2사단이 북한군 제 1군단(군단장 중장 김웅) 예하의 2개 사단과 1개 기갑여단으로 구성된 공격집단의 침공을 막아, 이를 격멸코자 한 방어전이다.   그 경과의 개요를 보면, 벽두에 제 7사단이 포천과 동두천 부근에서 서전을 치른데 이어, 대전에서 증원한 제 2사단이 의정부 부근에서 격돌케 되는 바, 바로 이 지역은 수도 서울의 관문과도 같아 피아간에 주력으로써 대결케 되었던 것이다.   그런데, 적은 처음부터 여기에 공격의 중점을 두고 병력과 화력을 집중투입한데 반하여 아군 측에서는 아무런 대비 없이 이와 맞섬으로써 전투 초기의 상황이 급박하게 변해갔다.   특히 이 지역은, 경원 본도인 3번 도로를 비롯하여 동측의 43번과 서측의 316번이 모두 양호한 노면에 열을 지은 듯 남북으로 뻗힌 데다, 광천산맥과 천보산맥이 종벽을 이루어, 방어하는 입장에서는 횡적연계와 종심배치에 불리한데 비하여 공격하는 입장은 기계화 부대의 운영과 공격 돌입이 용이하였다.   --------------------------------------------------------------------------------  2. 의정부지구 전투의 주요 지휘관    *아군   제 7사단장 준장 유재흥   (6월 26일 14:00부로 의정부지구 전투사령관)   제 1연대장 대령 함준호   제 1대대장 중령 한태원   제 2대대장 소령 이의명   제 3대대장 소령 김황목   제 9연대장 중령 윤춘근   제 1대대장 소령 류환박   제 2대대장 소령 전순기   제 3대대장 소령 이철원   제 5포병대대장 소령 이규삼   배속부대   수도경비사 예하,   제 3연대장 중령 이상근   제 1대대장 소령 임백진   제 2대대장 소령 박남표   제 3대대장 소령 김붕상   제 18연대장 중령 임충식   제 2대대장 소령 장춘권   제 3대대장 소령 안민일   보국대대 제 2중대장 중위 박창암   기갑연대 장갑차 1개소대   포병학교 대전차포 2개중대   제 2사단장 준장 이형근   제 5연대장(대리)중령 박기성   제 1대대장 소령 이정도   제 2대대장 소령 차갑준   제 16연대장 대령 문용채   제 1대대장 중령 유의준   제 2대대장 중령 김 헌   배속부대   제 25연대장 중령 김병휘   제 2대대장(대리) 대위 나희필   제 3대대장 소령 고동석   포병학교 제 2교도대장 소령 김풍익   육군사령학교장 준장 이준식   생도대대장 중령 조 암   배속부대   서울시경 전투경찰대대   인접부대   우 인접 : 제 6사단장 대령 김종오   좌 인접 : 제 1사단장 대령 백선엽      *적군   북한군 제 1군단장 중장 김웅   제 3사단장 소장 이영호   제 7연대장 대좌 김창봉   제 8연대장 중좌 김병종   제 9연대장 대좌 김만익   포병연대장 대좌 안백성   제 4사단장 소장 이권무   제 5연대장 대좌 최인덕   제 16연대장 대좌 박승희   제 18연대장 대좌 김희준   제 105기갑여단장 소장 유경수   제 107, 109 전차연대기간   --------------------------------------------------------------------------------  3. 의정부지구 전투의 진행과정    육군총참모장은 제7사단사령부를 2회 시찰한 후 재경부대를 의정부지역에 우선적으로",전쟁기념관,1950.6.26,경기도 의정부,"유재흥 준장, 함준호 대령","한국전쟁사(국방부), 한국전쟁사(전쟁기념사업회), 38도선 초기전투(국방부 "
2,내촌-태릉지구 전투,"상세설명   1. 내촌-태릉지구 전투의 개요.    육군사관학교장(이준식 준장)은 25일 13.00, 육군본부 명령에 따라 생도대대와 배속된 전투경찰대대를 391번 도로를 통제할 수 있는 내촌 부근의 감제고지에 배치하였다. 다음날 아군은 남하하는 적과 격전을 치른 후 태릉으로 철수하여 제 9연대와 더불어 불암산~태릉 일대에 방어진지를 편성하고 미아리~태릉방어선의 우측 일각을 담당하게 되었다.   --------------------------------------------------------------------------------  2. 내촌-태릉지구 전투의 주요 지휘관    육군사관학교장 준장 이준식   육군사관학교 대대장 중령 조암   제 9연대 1대대장 소령 유환박   --------------------------------------------------------------------------------  3.내촌 -태릉지구 전투의 진행과정    가. 내촌면 내리지구의 전황      1) 생도대대의 출동   내촌면 내리 부근은 포천과 기산리에서 퇴계원에 이르는 391번 도로상의 분기지점으로 만일에 이곳이 적 수중에 넘어가 적이 서울 동북쪽을 휩쓴다면 의정부의 보유가 아무런 뜻이 없는 까닭에 방어가 시급한 곳이었다. 채병덕 소장이 25일 의정부 전황을 둘러보고 수도의 경비문제가 아주 위급한다고 판단하여 재경 각 군사학교의 기간병력을 집결시켜 수도경비를 충당할 예정으로 보병학교의 유해준 중령으로 하여금 보병학교 교도대와 육군사관학교 교도대및 생도대대를 통합하여 수도방어특별연대로 편성할 것을 지시하였다. 그러나 아주 급박한 상황변화때문에 보병학교와 사관학교 교도대는 1사단에 배속하여 문산에 급파하였고, 생도대대는 7사단의 동측방을 방어하도록 지시하였다. 이 명령을 받은 이준식교장은 사관생도를 소총수로 출동시키는 것에 대한 찹찹한 심정도 있었으나, 조 암 중령을 대대장으로 임명하여 생도대대를 편성하였다.   편성을 마친 대대는 16:00를 기하여 출동하였고, 391번 도로와 326번 도로가 맞닿는 &#39Y&#39자형 교차로 남쪽고지(372고지)에 진지를 급편케 하였고, 이 지역은 서파와 송우리로 통하는 요지로서 제 7사단 작전지역의 동측 후방에 해당되는 곳이다.      2) 내리 부근의 전황   06:00에 경찰대대가 현지에 도착하자 조암 중령이 이를 통합지휘하여 372고지 동북쪽의 330고지를 점령하도록 하였다. 이리하여 양 대대는 함께 진지를 보강하면서 일부병력으로 정세를 탐색하였는데, 특히 제 1중대장 송인률 대위는 소대병력을 자신이 직접 지휘하여 내리 서쪽의 325번 도로상에 대 전차용 호를 파고, 대인 지뢰를 매설하는 등 방어작업을 실시하였다. 그러나 15.00이 지나도록 이 지역에는 아무런 적 움직임이 없었다.   이윽고 16:00를 기하여 진목리의 경찰분소에서 대규모의 적이 국사봉(547고지) 남쪽으로 움직인다는 보고가 들어왔다. 이들은 적 제 3사단 9연대 소속으로 대좌 김만익이 지휘하여 사단의 동 측방에 침공한 것으로 보여졌다. 이 때에 생도대대는 동북쪽의 전황을 지켜보고 있었는데, 330고지를 점령한 적이 그 여세를 몰아 대대 정면으로 공격해왔다. 이리하여 그 주력이 82mm 박격포와 45mm반전차포 및 기관총 등의 엄호하에 내리 서남쪽의 개활지를 횡단하려 하자 대대의 전 화력이 동시집중사격을 가하였는데 특히 진지 앞 300m 거리를 두고 최후 저지사격을 가하였다.   그러나 이들은 쉽사리 물러서지 않고 내리 서쪽의 312고지 부근",전쟁기념관,1950.6.26-6.28,"경기도 내촌, 태릉","이준식 준장, 조암 중령","한국전쟁사(국방부), 한국전쟁사(전쟁기념사업회), 38도선 초기전투(국방부 "
3,창동지구 전투,"상세설명   1. 창동지구 전투의 개요    북괴의 기습적인 전면 남침으로 38도 분계선에 연한 전 전선이 무너지자, 육군본부는 38도선으로부터 45km에 불과한 수도 서울에 대한 위협에 직면하게 되었다. 이에 아군 제5사단(사단장 소장 이응준(應俊))과 제7사단(사단장 준장 유재흥(載興))은 미아리, 창동 지역에서 적의 남침을 제지하였으나 적의 전차 앞에 후퇴하게 되었다.   --------------------------------------------------------------------------------  2. 창동지구 전투의 주요 지휘관    *아군   &lt미아리지구전투사령관&gt   (좌일선부대)   제 5사단장 소장 이응준   제 20연대장 대령 박기병   제 1대대장 소령 김한주   제 2사단   제 16연대(혼성)장 대령 문용채   제 25연대(혼성)장 중령 김병휘   수도경비사   제 3연대(혼성)장 중령 이상근      &lt의정부지구전투사령관&gt   (우일선부대)   제 7사단장 준장 유재흥   제 1연대(혼성)장 중령 이희권   제 5사단 제15연대   제 2대대장 소령 안광영   수도경비사령부 제 8연대   제 2대대장 소령 고백규   포병학교장(대리) 중령 김계원   공병학교장 중령 엄홍섭   제 3사단 공병대   제 1소대장 소위 이종두   병참학교장 중령 백선진   헌병사령관 대령 송요찬      *북한군   제 1군단장 중장 김웅   제 3사단장 소장 이영호   제 7연대장 대좌 김창봉   제 8연대장 중좌 김병종   제 9연대장 대좌 김만익   포병연대장 대조 안백성   제 4사단장 소장 이권무   제 5연대장 대좌 최인덕   제 16연대장 대자 박승희   제 18연대장 대좌 김희준   제 105전차여단장 소장 류경수   --------------------------------------------------------------------------------  3. 창동지구 전투의 진행과정    서울강점에 혈안이 된 적은 전날 의정부-문산선을 약취하자 이날 04:00부터 남침을 재개하여 퇴계원-창동-봉일천등 3개 방향으로 그 주공을 지향하였다.   즉, 의정부 회랑을 통하여 서울로 진출한 것으로 보이는 북한군 제 4사단은 이날 불효를 기하여 침습을 재개하였으나, 그들 선두부대가 아군 제 25연대에 의하여 격퇴되어 일시 공격을 중지하고 재편성하였던 것으로 보였는데 그로부터 수 시간이 지난 10:00에는 창동선 일대에 포탄을 집중시키면서 11:00에는 그 선두 전차로써 진전으로 육박하였다.   이무렵 창동선의 제 1선 전투부대 뒤에는 독전대, 그리고 제 3선에는 헌병을 배치하여 병력철수의 통제와 낙오병의 수용임무를 부여하여 진용을 가다듬고 있었으나, 이곳 장병이 갈망하는 탄약과 급식문제가 해결되지 않음은 물론, 미 공군기의 폭음도 들리지 않았다. 이러한 실망 속에 적탄의 집중은 치열하고, 각 부대와의 연락 유지마저도 이루어지지 않았다.   이때 김계원 중령이 지휘하는 6문의 105mm 곡사포는 일제히 포문을 열어 그들의 대열을 분산시키고 진출을 둔화시키는데 혼신의 힘을 다하였으나, 1시간 뒤에는 포탄이 소진되고 수적으로 우세한 적에게 역불급하여 11:00에는 포차와 더불어 미아리 고개로 철수하였다.   전황을 주시하고 있던 사령관은 지세적으로 불리한 창동선의 유지가 어려울 것으로 내다보고, 각 부대를 철수시켜 미아리 고개에서 극력 저지할 것을 결심하였다. 그리하여 각 부대를 담당한 연락장교로 하여금 미아리로 철수하라.는 ",전쟁기념관,1950.6.26-27,창동,"유재흥 준장, 이응준 소장","한국전쟁사(국방부), 한국전쟁사(전쟁기념사업회), 38도선 초기전투(국방부 "
4,F-51 무스탕 전투기 인수,"상세설명   1. F-51 무스탕 전투기 인수의 개요    적은 전투기를 보유하였을 뿐 아니라 전차를 가지고 있었으며 이를 앞세운 기동부대의 남침을 우리 육군은 저지할 수가 없었다.   즉, 육군이 보유한 2.36인치 로켓포나 57mm대전차포로서는 T-34형 전차를 격파할 수 없었으며 더욱이 우리 공군은 한 대의 전투기도 보유치 못하였으므로 그들은 공중으로 부터의 위험을 별로 받지 않은 채 쉽게 그리고 빠른 속도로 남침하였던 것이다.   그리하여 공군은 그들의 전차를 격파하여 남침을 저지하기 위한 방법으로 미국에게 전투기의 지원을 요청하였으며, 우리 공군의 조종사 10명이 일본으로 건너가 직접 F-51 무스탕 전투기를 조종하여 대구 비행장에 도착하기에 이르렀다.   --------------------------------------------------------------------------------  2. F-51 무스탕 전투기 인수의 주요 지휘관    비행단 장 대령 이근석   출격조종사   대령 이근석   중령 김영환 장성환   대위 김신 박희동 강호윤   중위 장동출 정영진 김성용 이상수   --------------------------------------------------------------------------------  3. F-51 무스탕 전투기 인수의 진행과정    전황의 위급함을 알게 된 총참모장 김정열 준장은 25일 오후에 국방부장관에게 전차를 파괴할 수 있는 가장 빠른 방법은 미군으로부터 전투기를 지원받는 것입니다.라고 진언하자 신성모 장관은 즉시 이승만 대통령에게 전황이 위급하다는 사실과 함께 이를 상신하였다.   이 대통령은 보고를 받자 미 극동군사령부에 전투기의 지원을 요청한 결과 동 사령부는 이를 수락하여 26일 오전에 전투기 지원에 대한 협의를 하기 위하여 미 극동군사령부에서 담당참모가 수원기지에 도착하였다.   그리하여 그는 총참모장에게 한국공군 조종사 가운데 F-51 전투기를 전혀 훈련 없이 전투 할 수 있는 조종사가 몇 명이 있느냐?라고 질문하였다. 이에 총참모장은 여러 가지를 고려한 끝에 10명이 가능하다.라고 대답한 즉, 그는 즉석에서 그러면 10대를 지원하여 줄 테니까 10명을 수원기지에 대기시켜 달라. 그러면 내가 일본으로 가서 수송기를 보내겠다.라고 말하였다.   그 뒤 총참모장은 여의도 기지에 돌아와 비행단장 이근석 대령과 이에 대하여 협의한 끝에 과거에 비행경험이 많고, T-6기를 타던 이근석 대령을 비롯하여 김영환 중령과 장성환 중령 그리고 김 신 대위와 박희동 대위 및 강호윤 대위에 이어 장동출 중위와 정영진 중위 그리고 김성용 중위와 이상수 중위 등 10명을 선정하였다.   이들은 이 날 19:00에 수원기지에서 미 C-47 수송기에 탑승하여 21:00에 일본 구주에 있는 이타주케(Itazuke)기지에 도착하였다.   이 때 동 기지에는 미 제 8전투폭격비행단이 주둔하였는데 일행은 동단의 제 36전투폭격대대 훈련대에 배속되었다.   왜냐하면 아직 F-51전투기의 정비가 끝나지 않아 동 기지에 도착하지 않았으며 또 당시 일본의 규슈(Kyushu) 지방은 우기로 말미암아 기상이 고르지 못하였기 때문에 일행은 우선 F-51기에 대한 교육을 받았다.   즉, 27, 28 양일간은 기상이 불순한 가운데 F-51기의 제원 및 기능에 대하여 지상교육을 받고 29일에도 기상이 쾌청치 않았으나 일행은 이타주케(Itazuke)기지 전방에 있는 칸노수(Kannosu)비행장에서 T-6기로서 시험비행을 하였다.   즉, 미 교관들이 일행을 교육하는데 있어서 조",전쟁기념관,1950.6.26-7.4,"서울, 안양 상공","이근석 대령, 김영환 중령","한국전쟁사(국방부), 한국전쟁사(전쟁기념사업회), 공군사 제1집"
5,봉일천지구 전투,"상세설명   1. 봉일천지구 전투 개요    봉일천지구 전투는 개성문산지구 전투의 일원으로 청단(靑丹)연백(延白)개성고랑포(高浪浦) 일대에서 패한 한국군 제 1사단이 봉일천에서 북한군 제 1 및 제 6사단과 맞서 싸운 방어전투이다.   그러나 제 12연대는 초전에 분산되어 영정포에서 한강 하구를 도하하여 김포반도(浦半島)와 문산리로 철수하였으며 38도 분계선의 대원리(大院里)-원당동(元堂洞)간을 방어하던 제 13연대 3대대 또한 임진강 남쪽으로 분산 철수하였다.   --------------------------------------------------------------------------------  2. 봉일천지구 전투의 주요 지휘관    *아군   제 1사단장 대령 백선엽   제 11연대장 대령 최경록   제 1대대장 대위 고한조   제 2대대장 소령 정영홍   제 3대대장 소령 김재명   제 12연대장 대령 김점곤   제 1대대장 소령 신현홍   제 2대대장 소령 한순화   제 3대대장 소령 이무중   제 13연대장 대령 김익열   제 1대대장 소령 김진위   제 2 대대장 소령 윤천태   제 3대대장 소령 유재성      *적군   제 1사단장 소장 최광   제 1연대장 대좌 황석   제 2연대장 대좌 김양춘   제 3연대장 총좌 이창권   제 6사단장 소장 방호산   제 13연대장 대좌 김순진   제 14연대장 대좌 한일래   제 15연대장 대좌 김현기   --------------------------------------------------------------------------------  3. 봉일천지구 전투의 진행과정    1) 봉일천방어선의 배치상황      적의 강한 압력에 의해 26일 오후에 임진강방어선에서 제 3방어선인 봉일천 부근의 최후 저지진지로 철수하게 된 아군은 연대별로 지연전을 펼치면서 위전리 일대에 배치된 제 15연대의 엄호하에 방어진지를 급편하게 되었다. 철수간에 제 6야전포병대대 2중대는 적 정찰대의 습격을 받아 105mm포 4문을 유기했으므로 제 1사단의 지원화력은 크게 약화되었다.   * 제 1사단의 봉일천방어선 배치   - 좌전방, 제 15연대 : 229고지~도내리(都內里)간 4km, 1번도로 좌우측 고지를 점령, 적의 주접근로를 방어   - 우전방, 제 13연대 : 도내리~신산리(新山里)간 4km   - 사단예비, 제 11연대 : 최후저지선에서 사단예비로 전환, 제 15연대 방어지대 남쪽에 2개 대대를 배치하여 1번도로의 방어를 강화   - 12연대 : 금천(金村)에서 재편성중, 집결병력1개 대대규모   제 1사단이 방어진지를 편성한 위전리의 문산천 일대는 개천과 1~1.8km 넓이의 전답지대가 서쪽에서 동쪽으로 이어지고 그 남쪽에 구릉지대가 북으로 향하여 횡격설을 이루고 있으므로 방어에 유리한 반면, 도로가 발달되어 있어 적의 기갑부대 운용에도 유리한 지형조건을 갖추고 있다.   제 1사단장은 이러한 지형적 특징을 감안하여 수세일변도의 방어작전으로써는 최후저지선을 지탱하기 어렵다고 판단하였다. 이에 사단은 공세적인 반격계획을 세우고 이를 실행할 수 있는 기회 조성에 주력하게 되었다. 그러면서도 제 1사단장은 육군본부와의 통신두절로 인접부대상황이나 전반적인 전황을 전혀 모르고 있었다.   한편 문산리~법원리(法院里)일대까지 남하한 적 2개사단은 보전포협동작전을 전개할 준비를 갖추고 공격을 위한 전투정찰을 실시하고 있었다.      2) 위전리 일대의 대전차전      6월 27일 10:00시를 전후하여 전차를 앞세운 적 제 6사단의 주공",전쟁기념관,1950.6.26-6.27,경기도 봉일천,"백선엽 대령, 최경록 대령","한국전쟁사(국방부), 한국전쟁사(전쟁기념사업회), 38도선 초기전투(국방부 "
6,미아리지구 전투,"상세설명   1. 미아리지구 전투의 개요    북한군의 기습적인 전면 남침으로 38도 분계선에 연한 전 전선이 무너지자, 육군본부는 38도 분계선으로부터 45km에 불과한 수도 서울에 대한 위협에 직면하게 되었다. 이에 아군 제 5사단(사단장 소장 이응준(應俊))과 제 7사단(사단장 준장 유재흥(載興))은 미아리, 창동 지역에서 북한군의 남침을 저지하였으나 적의 전차 앞에 후퇴하게 되었다.   --------------------------------------------------------------------------------  2. 미아리지구 전투의 주요 지휘관    *아군   &lt미아리지구전투사령관&gt   (좌일선부대)   제 5사단장 소장 이응준   제 20연대장 대령 박기병   제 1대대장 소령 김한주   제 2사단   제 16연대(혼성)장 대령 문용채   제 25연대(혼성)장 중령 김병휘   수도경비사   제 3연대(혼성)장 중령 이상근      &lt의정부지구전투사령관&gt (우일선부대) 제 7사단장 준장 유재흥 제 1연대(혼성)장 중령 이희권 제 5사단 제15연대 제 2대대장 소령 안광영 수도경비사령부 제 8연대 제 2대대장 소령 고백규 포병학교장(대리) 중령 김계원   공병학교장 중령 엄홍섭   제 3사단 공병대   제 1소대장 소위 이종두   병참학교장 중령 백선진   헌병사령관 대령 송요찬      *적군   제 1군단장 중장 김웅   제 3사단장 소장 이영호   제 7연대장 대좌 김창봉   제 8연대장 중좌 김병종   제 9연대장 대좌 김만익   포병연대장 대조 안백성   제 4사단장 소장 이권무   제 5연대장 대좌 최인덕   제 16연대장 대자 박승희   제 18연대장 대좌 김희준   제 105전차여단장 소장 류경수   --------------------------------------------------------------------------------  3. 미아리지구 전투의 진행과정    26일 17:00시 쯤 용산에 도착한 제 5사단은 서울 방어 임무를 띠고 미아리에 배치되었다. 이 때 제 5사단장 지휘 하에 들어간 부대는 제 15연대 2대대와 제 20연대 1대대 및 다음날 회기동에 배치 된 수도경비사령부 예하 제 8연대 2대대 등 3개 대대 뿐이었다. 그러나 회기동의 제 2대대는 통신장비의 미비로 독자적인 작전을 수행할 수밖에 없었다.   창동 방어선이 무너진 지 약 2시간이 지났을 때부터 철수 병력이 미아리 일대로 모여 들기 시작하였으며, 제 7사단장도 현지에 도착하였다. 여기에서 제 5사단장과 제 7사단장은 작전 임무를 보다 효과적으로 수행하기 위해 3번 도로를 포함한 좌측 부대는 제 5사단장이, 우측부대는 제 7사단장이 각각 지휘하기로 합의하였다. 27일 오후까지 미아리~회기동 방어선에 배치된 아군 병력은 3000명 정도였지만 제 5사단 예하 2개 대대와 제 8연대 예하 1개 대대를 제외한 기타 부대 장병들은 3일 동안 패전과 철수를 거듭한 충격과 굶주림 및 탄약부족, 또한 전차에 대한 공포증과 지휘 체계의 문란으로 저투의지를 잃고 있었다.  &lt미아리~회기동 방어선의 부대 배치&gt    좌전방 부대: 제 5사단장이 지휘   -제 5사단 전술 지휘소 : 103고지   -제 20연대 1대대 : 171고지 동쪽   -제 1연대(1개 대대규모) : 길음교 북쪽 공동묘지   -제 15연대 2대대 : 미아리 고개 132고지    우전방 부대 : 제 7사단장이 지휘   -제 7사단 전술 지휘소 : 미아리 고개 동쪽 164고지   -혼성 연대 : 164고지 북동쪽   제 3연대, 제 5연대, 제 16 연",전쟁기념관,1950.6.26-6.27,미아리 일대,"이응준 소장, 박기병 대령","한국전쟁사(국방부), 한국전쟁사(전쟁기념사업회), 38도선 초기전투(국방부 "
