행번호,제목,내용,등록자,시기,지역,인물,출처
49,안동-영주-단양 진격전,"상세설명  1. 안동-영주-단양 진격전의 개요     본 전투는 제 2군단이 육본작전명 제191호에 의하여 제 6사단을 주공으로 하여 창원-충주선을 따라 진격토록 하는 동시에 제 8사단을 조공으로 하여 의성-안동-영주 선을 따라 무제한 진격토록 한 총반격전의 일부에 속한다.      --------------------------------------------------------------------------------  2. 안동-영주-단양 진격전의 주요 지휘관   *아군  제2군단 장 소장 유재흥  제8사단 장 준장 이성가  제10연대 장 대령 고근홍  제16연대 장 중령 유의준  제21연대 장 대령 김용배   *적군  제2군단 장 중장 김무정  제8사단 장 소장 오백용  제81연대 장 총좌 이영래  제82연대 장 총좌 사 세  제83연대 장 중좌 오윤섭  포병연대 장 중좌 김명항    --------------------------------------------------------------------------------  3. 안동-영주-단양 진격전의 진행과정     가. 전투전의 개황     제 8사단은 의성을 점령, 확보하는 즉시로, 패주하는 적을 추격하면서 안동-영주-단양선으로 진격을 계속한 다음, 우측 인접부대인 수도사단과 좌측 인접부대인 제 6사단의 진격에 발맞추어 38도선을 향해 급속히 진격할 준비를 갖추었다.     나. 작전계획     제 8사단장 이성가 준장은 요지, 다음과 같은 육본 작명 제191호에 의하여 현재 선에서 계속 적을 추격하여 의성-안동-영주선으로 진격할 목적으로, 제10연대(연대장 대령 고근홍)를 우일선으로 하고 제21연대(연대장 대령 김용배)를 좌일선으로 전개하는 동시에, 제16연대(연대장 중령 유의준)를 예비대로 공치한 다음, 안동-영주선을 따라 반격전의 예봉을 우선 38도선을 목표로 깊이 지향코자 하였다.     다. 안동-영주-단양의 진격전     9월 22일    제10연대(연대장 대령 고근홍)는 전날 자천동 동북쪽의 보현산(1,124) 일대에서 완강히 저항하는 적을 격파하고, 쉴 사이 없이 북진하여, 이날 06:00부터 포병의 밀접한 엄호사격을 받으면서 어봉산(634)과 그 동북쪽의 역마산(648)에 진지를 점령하고 있는 적을 공격하기 시작하였다. 연대장 고근홍 대령은 제1대대로 하여금 어봉산 쪽으로 공격토록 하고, 제2대대와 제3대대로 하여금 제1대대의 뒤를 따라 원사촌(어봉산 남쪽 3km 지점)까지 진격한 다음, 제1대대가 어봉산을 점령하는 즉시로 제2대대와 제3대대를 월정동을 경유, 고모산 서쪽으로 전진하여 역마산을 공격토록 하였다.    제1대대는 어봉산 남쪽 불로동까지 진격하였을 때, 동남쪽 능선에 배치된 적 자동화기의 집중사격을 받았으나, 지형 상으로 불리한 위치에 있는 대대는 더 이상 진출하지 못하고 있었으므로 연대장 고근홍 대령은 즉시 포병 화력을 요청하여 적 진지를 강타하는 동시에 원사촌까지 진출하고 있던 제2대대로 하여금 제1대대를 초월, 공격토록 명령하였다. 제2대대는 제1대대의 좌측에 있는 사리고개 쪽으로 우회하여 어봉산을 공격하였다. 적의 자동화기는 아군의 집중포화에 의하여 제압되고, 제1대대와 제2대대는 일제히 육박전으로 적진에 돌입하였고, 적은 계곡을 따라 일로 구산동 쪽으로 패주하기 시작하였다. 연대장은 이 기회를 놓칠세라 제3대대로 하여금 주요한 감제고지인 역마산을 향해 공격을 시작하였는데, 적은 산발적인 저항으로서 계전의지를 상실하고 역마산 북쪽 능선을 따라 명당동 쪽으",전쟁기념관,1950.9.22-9.29,"안동, 영주, 단양","유재흥 소장, 이성가 준장","한국전쟁사(국방부), 한국전쟁사(전쟁기념사업회)"
50,UN해군 서해안 철수작전,"상세설명  1. UN해군 서해안 철수작전의 개요     북진을 거듭하며 압록강을 눈 앞에 둔 시점에 있던 아군은 중공군의 개입으로 철수를 계획하지 않을 수 없는 상황에 처해지게 되었다. 이에 UN해군은 긴급히 진남포로 수송선단을 보내 아군의 원활한 철수를 가능하게 하였으며, 이 과정에서 복서(Boxer)호가 좌초되는 위기를 겪기도 하였으나 무사히 철수작전을 완수하였다.      --------------------------------------------------------------------------------  2. UN해군 서해안 철수작전의 주요 지휘관   극동함대 사령관 미 해군중장 씨 조이(C. T. Joy)  제 90기동부대(TF 90)사령관 미 해군소장 제이 도일(J. H. Doyle)  제 90.1기동전대(TG 90)사령관 미 해군소장 엘 택리(L. A. Thackrey)  제 1수송전단(Transportation squadron) 사령관 미 해군대령 에스 켈리(S. G. Kelly)  제 95기동부대(TF 95)사령관 미 해군소장 에이 스미스(A. E. Smith)  제 95.1기동전대(TG 95.1)사령관 영 해군소장 써 엔드류스(Sir. W. G. Andrews)  제 95.12기동분대(TU 95.12)사령관 가 해군대령 제이 브록(J. V. Brock)    --------------------------------------------------------------------------------  3. UN해군 서해안 철수작전의 진행과정     가. 작전 전의 개황     1950년 11월 초순 아군이 압록강을 목전에 두고 쾌속조로 북진을 계속하고 있을 무렵에 한 가닥의 어렴풋한 두려움이 기동해역의 미 해군 고급장성들의 심중을 괴롭히고 있었다. 중공군의 출현을 알리는 산발적인 보고라던가 후퇴를 계속하는 적이 집요한 저항을 기도하지 않는 점이며 서부전선의 미 제 8군과 동부전선의 미 제 10군단 사이의 단절된 전선, 그리고 날로 발악을 더하여가는 중공의 북경방송의 호전적인 선전 등은 앞으로 닥쳐올 불길한 사태를 예고하는 듯이 보였던 것이다.    이와 같은 분위기 속에서 조이(C. T. Joy) 중장의 미 기동함대 사령부에서도 한국전선에 중공군의 모습이 나타났을 무렵부터 앞으로 있을지도 모르는 총체적인 위기에 대처하는 방안을 강구하고 있었다.    이 계획은 진척되어 11월 13일 제 116-50작전이라고 명명되어 하달되었는데 이 작전계획에는 비상시에 UN군을 한국으로부터 철수시키는 절차를 포함하고 있었으며 또한 한국과 일본의 각 항구의 수로와 화물을 적재할 때에 필요한 세부적인 정보도 기재하고 있었고 각형 함정의 인원과 탑재능력도 기술하고 있었다. 이 계획에 의하면 미 제 90상륙기동부대 사령관이 각 해역의 해군부대의 지원을 받아가며 공군과 해군의 전 작전을 지휘하게 되어 있었다.     나. UN해군의 서해안 철수작전     1950년 12월 1일 일본에 있던 APA 베이필드(Bayfield)호에 승조한 미 해군의 제 1수송전단 사령관 켈리(S. G. Kelly)대령은 제 90.1기동전대에 소속되어 인천으로 가라는 명령을 받고 출항하였다.    3일 황해를 향하여 항해 중이던 켈리 대령은 기동함대 사령관인 조이 중장으로부터 제 90.1기동전대 사령관 택리(Thackrey) 소장에게 보내는 전문을 방수하였는데 거기에는 베이필드호를 포함한 함정들을 급히 진남포로 파견하여 줄 것을 미 제 8군이 요청하고 있다는 사연이 있었다. 그러나 켈리 대령은 기동함대 사령부의 전문에서 받은 여운과 자신에 대한 행동지시의 결여로 다섯 시간이나 속을 태우고 있었다. 22:00에 이르러 그는 드디어 더 이상 기다릴 수 없다고 판단하고 현지로 갈 것을 결심하",전쟁기념관,1950년 12월 초,서해안 일대,"조이(C. T. Joy) 해군 중장, 제이 도일(J. H. Doyle) 해군 소장","한국전쟁사(국방부), 한국전쟁사(전쟁기념사업회)"
51,흥남 철수작전,"상세설명  1. 흥남 철수작전의 개요     이 작전은 미국군 제 10군단(군단장 소장 아몬드(Edward M. Almond))과 한국군 제 1군단(군단장 소장 김백일(伯一))이 교두보의 확보와 혈전을 병행하면서 다른 한편으로는 해로를 따라 대거 철수한 작전으로서, 이는 흔히 말하는 제2차 세계대전 초기 던커크(Dunkirk)에서의 철수와 유사한 작전이라고 할 수 있다. 당시 피아의 병력비율은 5:1이란 현격한 차이가 있었음에도 불구하고 이 철수 작전에 선행하는 해안 보루의 유지확보에 육해공 삼군의 입체적인 협조의 묘를 유감없이 발휘함으로써 해상 철수라는 난관을 성공리에 수행할 수 있었다.      --------------------------------------------------------------------------------  2. 흥남 철수작전의 주요 지휘관   *아군  미 제 10군단장 소장 에드워드 아몬드(Edward M. Almond)  제 3사단장 소장 로버트 소울(Robert H. Soule)  제 7연대장 대령 제임스 보스웰(James O. BOswell)  제 15연대장 대령 데니스 무어(Dennis M. Moore)  제 65연대장 대령 윌리엄 해리스(William W. Harris)  제 7사단장 소장 데이비드 바(David G. Barr)  제 17연대장 대령 허버트 포웰(Herbert B. Powell)  제 31연대장 대령 리차드 오븐샤인(Richard P. Ovenshine)  제 32연대장 대령 찰스 뷰챔프(Charles E. Beauchamp)  제 1해병사단장 소장 올리버 스미스(Oliver P. Smith)  제 1연대장 대령 루이스 풀러(Lewis B. Puller)  제 5연대장 중령 레이몬드 머레이(Raymond Murray)  제 7연대장 대령 호머 리챈버그(Homer L. Litzanberg)  지원부대  Task Force 90.(기동부대) 소장 도일(J. H. Doyle)  Task Group 90.2(수송전단) 대령 켈리(S. G. Kelley)  Task Group 90.8(함포지원전단) 소장 힐렌쾨터(R. H. Hillenkoetter)  Task Group 95.2(호송 및 소해전단) 소장 히긴스(J. M. Higgins)  미 제 7함대 사령관 중장 스트러블(A. D. Struble)  Task Force 77.(고속항공모함부대) 소장 이웬(E. C. Ewen)  Task Group 96.8(호위항공모함전단) 소장 루블(R. W. Ruble)  Task Group 79.2(군수지원전단) 대령 오스틴(B. L. Austin)  병력  지상군 2개사단 O/T 및 E/T   *적군  중공 제 3야전군 사령관 진의(陳毅)  제 9집단군 사령관 송시륜(宋時輪)  제 20군장 장익상(張翼翔)  제 58사단(제 172, 제 173, 제 174연대)  제 59사단(제 175, 제 176, 제 177연대)  제 60사단(제 178, 제 179, 제 180연대)  제26군장 장인초(張仁初)  제 76사단(제 226, 제 227, 제 228연대)  제 77사단(제 229, 제 230, 제 231연대)  제 78사단(제 232, 제 233, 제 234연대)  제 27군장 팽덕청(彭德淸)  제 79사단(제 235, 제 236, 제 237연대)  제 80사단(제 238, 제 239, 제 240연대)  제 81사단(제 241, 제 242, 제 243연대)  북한군  제 4군단  제 5군단  제 8군단  기타 단대호 미상의 제부대  병력  총 6-10만 명    --------------------------------------------------------------------------------  3. 미 제 10군단의 흥남 철수 작전의 진행과정     미 제 21해병사단을 제외한 한국과 미국의 모든 지상 병력이 함흥-흥남부근에 이동을 완료할 즈음인 12월 9일에 맥아더(MacArthur) 원수는 아몬드(Almond) 소장에게 흥남철수에 관한 다음과 같은 명령을 하달하였다.  미 제 10군단은 흥남에서 부산과 마산 및 울산으로 해상 철수하여 부대를 집결시키고 미 제 8군사령관 지휘 하에 들어가라    이와 같은 명령을 받은 아몬드 소장은 그간 통합 지휘하였던 한국군",전쟁기념관,1950.12.14-12.24,함남 흥남,"로버트 소울(Robert H. Soule) 소장, 데이비드 바(David G. Barr) 소장","한국전쟁사(국방부), 한국전쟁사(전쟁기념사업회)"
52,길주-청진-부령 진격전,"상세설명  1. 길주-청진-부령 진격전의 개요     수도사단(사단장 준장 송요찬)은 10월 15일부터 10월 30일 까지 사단 단독으로 함흥-흥남을 점령하였는데, 이 당시 제 18연대(연대장 대령 임충식)가 함흥 북쪽 장진호-부전호 남단과 수상리 북방까지 진격하였다가 미 제 10군단 1해병, 제 7사단에 진지를 인계하고, 10월 30일 연대 일부가 서양리(함흥북쪽 9km)에 집결하여 이후 작전에 대비하고 있었으며, 제 1연대(연대장 대령 한신)는 홍원-북청 경유, 풍산과 홍군을 점령하고 있다가 미 제 7사단 17연대에게 진지를 인계하고, 동해안 도로로 우회하여 이미 제 1기갑연대에 의해 점령되었던 단천을 경유, 10월 30일 성진으로 이동하였으며, 제 1기갑연대(연대장 대령 김동수)는 북청에서부터 단독으로 이원-단천-성진을 차례로 점령하고, 10월 30일 현재 성진시 학성동에서 길주력면을 공격하기 위해 전열을 가다듬고 있었다. 즉 10월 30일까지는 사단 예하 3개연대가 각기 단독으로 진격하였다가 사단의 길주-명천이북의 공격을 위해 다시 합동하여 길주 북방의 동해안 도로를 중심으로 추격하기 위하여 사단전력을 집결하였던 것이다.    이무렵 장진-풍산선에서는 몇몇의 중공군이 침입하여 전선을 긴장시켰으며, 성진 북방에는 적 제 41사단 및 제 507여단등이 길주를 위시하여 그 북쪽 명천-어랑촌 등지에서 방어진지를 구축하고 완강히 저항하고 있었다. 10월 30일 동해안연도를 진격하고 있던 제 1기갑연대가 성진을 점령하자 사단사령부는 곧 단천으로 전진하여 길주와 그 북방의 진격에 따르는 모든 대책을 강구하고 있었다.      --------------------------------------------------------------------------------  2. 길주-청진-부영 진격전의 주요 지휘관   *아군  제 1군단장 소장 김백일  수도사단장 준장 송요찬  제 1연대장 대령 한 신  제 1대대장 대위 함용익  제 2대대장 소령 신언국  제 3대대장 대위 이성봉  제1기갑연대장 대령 김동수  제 1대대장 소령 박경호  제 2대대장 대위 박익균  제 3대대장 소령 임관묵  제 18연대장 대령 임충식  제 1대대장 소령 이길영  소령 이병형(11월 10일부터)  제 2대대장 소령 김봉상  제 3대대장 소령 안민일  배속부대  제10야포대대  수도야전공병대대  병력 : 약 12,000명  장비 : 105mm 곡사포 18문  57mm 대전차포 14문  81mm 박격포 20문  60mm 박겨포 25문  3.5inch 로켓트포 30문   *적군  제41사단  제509여단    --------------------------------------------------------------------------------   3. 길주-청진-부령 진격전의 진행과정    수도사단장 송요찬 준장은 10월 30일 성진을 점령하고, 사단 선두부대가 성진 북쪽 3km에 있는 학성동에 진격하여 진지를 점령하게 되자, 일단 부대를 정비한 다음 다시 길주(성진 북쪽 30km) 공격을 위해 만반의 준비를 하고 있었다. 길주는 함경선과 혜산선의 철로와 간선도로의 분기점으로 이곳을 점령, 확보해야만 단만강반까지의 진격작전이 용이하게 되고, 북위 41선을 제압하는 결과가 되기 때문에 우선 여기를 점령, 확보키로 하였다. 그래서 성진을 점령하고 선두에 진출해 있는 제 1기갑연대(연대장 대령 김동수)로 하여금 간선도로를 따라 정면 공격케 하였고, 풍산에서 우회 전진하여 성진에 진출한 제 1연대(연대장 대령 한신)를 우일선 공격제대로써 임명동-",전쟁기념관,1950.11.1-11.30,"함북 길주, 청진, 부령","한신 대령, 김동수 대령, 임충식 대령","한국전쟁사(국방부), 한국전쟁사(전쟁기념사업회)"
53,영덕-강구지구 전투,"상세설명  1. 영덕-강구지구 전투 개요      본 전투는 포항 북쪽 45km의 요새인 영덕-강구지구에서 수행 된, 동해안 지연작전의 대미를 장식한 일전이었다.    즉 1950년 7월 4일에 제 23연대(연대장 중령 김종원)를 기간으로 평해에서 일단 재편한 제 3사단(사단장 대령 류승열, 7월 9일까지) 이 8월 상순에 장사에서 해안 철수하여 포항으로 이전하기에 앞서, 독자적으로 지연작전을 수행한 마지막 방어전이기 때문이다.      --------------------------------------------------------------------------------  2. 영덕-강구지구 전투의 지휘관   *아군  제 3사단장 준장 이준식(7월 10일부터)  제 22연대장 중령 강태민  제 1대대장 소령 황명  제 2대대장 대위 장인걸  제 3대대장 소령 염정태  제 23연대장 중령 김종령(7월 31일까지)  제 1대대장 소령 박재열  제 2대대장 소령 백기천  제 3대대장 소령 허형호  독립 제 1대대장 중령 김종  공병대대장 소령 박기석  배속부대 강원도 경찰대대장 경무관 윤명운  지원부대 포병 제 11대대장 소령 노재현  미 제 159야포대대 C포대  미 제 40전투비행대대  미 제 7함대 일부  영 극동해군 일부   *적군  북한군 제 2군단장 소장 김광협  중장 김무정(7월 10일부터)  제 5사단장 소장 마상철(제10, 11, 12연대 기간)  제 766 부대장 총좌 오진우    --------------------------------------------------------------------------------  3. 영덕 강구지구 전투 진행과정     가. 전투전의 개황     7월 4일, 평해에서 철수한 제 23연대를 영해로 수용한 사단은 신병으로써 울진 이래의 병력손실을 보충하는 한편, 제 22연대의 조속한 복귀를 육군본부에 요청하는 동시에 영등포학원을 독립 제 1대대에 배속시키는 조치로써 전력충전에 전력을 기울였다.    또한 전선이 영덕으로 근접됨에 따라, 동해상에 출동 중인 미 해군 제 7함대 일부 함정의 함포지원과 미 제 5공군의 출격이 점증하였으므로 사단은 이 강력한 지원 화력을 수시로 요청할 수 잇게 되었다. 사단은 재편한 제 23연대와 독립 제 1대대로써 북괴 제 5사단의 중압을 배제하고 있었는데, 7월 10일에 사단장이 경질됨에 따라, 방어개념을 일신하고, 영해-영덕문에서 종심 깊은 지연전을 단행키로 하였다.    즉 육군본부는 7월 9일 현재, 수원-음성방면으로 철수중인 제 22연대와 조속한 원대복귀를 명령함과 아울러 사단장 류승열 대령을 경남 편성관구사령관으로 전보하고, 육군 사령관학교장이던 이준식 준장을 신임 사단장으로 보임하였는데, 이는 포항을 고수하기 위하여 영덕-강구선에서 적군의 남진을 단호히 배제하려는 긴급 조치의 일환으로 간주되는 것이었다.    한편 미 제 8군 사령부는 동해안전선의 상황을 깊은 우려로 지켜보고 있었다. 포항의 항만과 영일 비행장의 귀추가 낙동강 전선의 형성에 막중한 영향을 미치기 때문이었다.    포항의 항만은 부산과 함께 전 전선에 대한 병참 물자의 주입구이며, 영일 비행장은 미 제 40전투비행대대의 기지로서 극히 중요시되고 있었다. 그러므로, 그 45km 북쪽 영덕-강구는 포항 방어의 마지막 요관으 로서, 확보되지 않으면 안되는 것이었다.    이 중요성에 비추어, 미 제 8군 사령관 워커(Walter H. Walker)중장은 작전참모 맥클린(Allen D. Maclean) 중령에게 해 전선에 대한 화력지원을 할때 가능한 모든 ",전쟁기념관,1950.7.4-7.9,경북 영덕,"이준식 준장, 강태민 중령, 김종령 중령","한국전쟁사(국방부), 한국전쟁사(전쟁기념사업회)"
54,정읍-장성-광주지구 전투,"상세설명  1. 정읍-장성-광주지구 전투의 개요      전라도 지역으로 진출한 적은 전주를 점령한 후, 광주를 향하여 남침을 계속하고 있었다. 당시 전라남도 지역의 아군은 빈약한 장비와 병력으로 간신히 버티고 있던 상황이었으며, 전차를 앞세우고 장성 지역으로 공격해 오는 적을 막기에 역부족이었다.     이에 아군은 광주를 적의 손에 내어줄 수밖에 없었으며, 전라도 지역을 점령한 적은 부산을 목표로 하여 마산-부산 방면으로 침공을 계속하였다.      --------------------------------------------------------------------------------  2. 정읍-장성-광주지구 전투의 주요 지휘관   *아군  서해안지구 전투  사령관 소장 신태영(겸 전북편성 관구 사령관)  신편 제 7사단장 대령 민기식  제 3연대장 중령 박현수  신편 제 9연대장 중령 유해준  신편 제 30연대장 김용주  육본특공대장 소령 배동인  기갑연대기병중대장 중위 박익균  고길훈부대(해병)장 소령 고길훈(7. 22에 김성은 부대로 개칭)  김성은부대 장 중령 김성은  민부대 장 대령 민기식(7. 20에 개칭)  독립대대 장 소령 김병화(7. 20에 김부대로 개칭)  오부대장 대령 오덕준  전북경찰전투사 사령관 경무관 윤기병  전북지구편성관구 사령관 소장 이응준  신편 제 5사단장 대령 이형석  신편 제 15연대장 중령 김병휘  이부대장 중령 이영규  신편 제 26연대장 중령 이백우  전남경찰전투사 사령관 경무관 이응권   *적군  제 4사단장 소장 이권무  제 16연대장 대좌 박승희  제 6사단장 소좌 방호산  제 13연대장 대좌 김후진  제 14연대장 대좌 한일래  제 15연대장 대좌 김현기  포병연대장 중좌 박해민    --------------------------------------------------------------------------------  3. 정읍-장성-광주지구 전투의 진행과정        7월 20일    당면의 적은 전날에 이리를 침탈하자 계속 광파를 휘몰아 전주와 김제를 동시에 침공하였다. 그때의 그들은 우선 전주를 공략한 연후에 광주를 직충하려는 것은 자명하였으므로 전주가 떨어진 다음부터는 일로 광주를 지향하는 그들의 침봉이 김제-정읍 도에 연하여 더욱 치성을 기한 것은 차라리 당연시되기도 하였다. 그러나 이에 당면케 된 아군의 배치는 전날 김제에서 적의 중위를 뚫고 정읍으로 물러난 해병 제 3중대(중대장 중위 이봉출)와 27명의 육본특공대(대장 소령 배동걸), 그리고 전남 경찰 1개 대대에 지나지 않았다. 그나마 이들은 전날 전투에서 탄약 휴대량을 거의 사모한 상태인데 겹친 급식의 중단 때문에 사기가 저하되어 있어서 적과의 정정당당한 대전이란 전혀 기대할 수 없는 상황이었다.    그러므로 이들을 적침을 저지할 수 없는 비분 속에서 이날 정읍에 이른 것인데, 여기에 서해안 지구 전투사령부와의 연락 또한 단절된 까닭으로 차후행동에 대한 아무런 지시도 받지 못하고 있었다.    상황이 이런 까닭으로 김제로 보원한 바 있는 전남 경찰 1개 중대는 스스로 이날 12:00에 원대로 복귀하는바 되고 잔여 부대들은 각기 부대장의 의도에 따라 수의로 행동하고 있었다. 적은 아군 상황이 이와 같이 김제-정읍 사이가 거의 개방 되었으므로 하등의 저항을 받음이 없이 정예 1개 연대규모로 이날 오후에는 태인(정읍 북쪽 10km)-신태인(태인 서북쪽 6km)에 돌입 하였으며 이미 그의 선봉을 ",전쟁기념관,1950.7.20-7.23,"전북 정읍, 전남 장성","신태영 소장, 박흥식 중령","한국전쟁사(국방부), 한국전쟁사(전쟁기념사업회)"
