행번호,제목,내용,등록자,시기,지역,인물,출처
99,수암산-유학산지구 전투,"상세설명  1. 수암산-유학산 지구 전투의 개요     수암산-유학산 전투는 16일간에 걸친 공방전이었다. 아군 제 12연대는 적 제 15사단에 많은 피해를 입혔으며 나중에 투입된 적 제 13사단에게도 큰 타격을 주었다.      --------------------------------------------------------------------------------  2. 수암산-유학산 지구 전투의 주요 지휘관   *아군  제 1사단장 준장 백선엽  제 12연대장 중령 김점곤  대령 박기병(8. 8부)  제 1대대장 소령 한순화  제 2대대장 소령 조성래  제 3대대장 소령 박병수(8. 19 전사)  제 3대대장 소령 김기용  배속부대  제 10연대장 소령 정순기  병력  제 12연대 20,00여명  제 10연대 3대대 500여명  장비 105mm 1개포대   *적군  제 15사단장 소장 박성철  제 28연대장 대좌 김치구  제 29연대장 미 상  제 50연대장 총좌 이을선  포병연대장 대좌 이연섭  제 13사단장 소장 최용진  제 19연대장 대좌 김병철  제 21연대장 대좌 이성준  제 23연대장 대좌 태병열  제 15사단 5,000명(8월초 현재)  제 13사단 9,500명(8월초 현재)    --------------------------------------------------------------------------------  3. 수암산-유학산 지구 전투의 진행과정     가. 전투전의 개황     아군 제 1사단의 중앙연대인 제 12연대는 낙정리 포남동에 이르는 전선에서 적에게 큰 타격을 주었고 특히 3.5인치 로케트포로써 적의 T-34 전차를 통쾌하게 파괴한 것은 장병들의 침체되었던 사기를 올리는데 매우 좋은 활력소가 되었던 것이다.    그러나 수암산과 유학산 일대는 이미 적이 13일 밤중에 진출하여 미명에 기습적으로 점령함으로써 제 2대대는 매남동에, 제 3대대는 유학산 남쪽의 517고지에, 그리고 제 1대대는 원정에서 각기 방어진지를 점령하지 않으면 안 되었던 것이다. 이 방어진지의 바로 뒤에는 왜관-다부동-대구에 이르는 도로가 있어 보급과 후송에 유리하였으나 적이 유학산을 먼저 점령함으로써 아군은 그들의 감제 관측을 면치 못하여 작전상의 새로운 약점을 노출시키게 되었다.     나. 수암산-유학산 지구의 전투     8월 13일    낙동강 선에서 인동, 신주막을 거쳐 야간 철수한 제 12연대는 08:00경에 다부동 부근에 집결을 완료하여 재편성을 실시한 다음 제 1대대는 유학산, 제 2대대는 수암산, 제 3대대는 예비로서 517고지를 점령하고자 오후에 진출하였으나 이미 적이 목표를 선제하고 있었다. 우선 제 2대대(대대장 소령 조성래)는 18:00에 좌측에서 미 기병사단의 포병지원을 받아 수암산(519고지)를 공격하여 제 6중대와 제 7중대가 19:00경에 이를 점령하였다. 이어서 주력은 제 5중대와 더불어 남쪽 능선상의 369고지의 적에 대하여 포위 태세를 갖추었다.    한편 제 1대대(대대장 소령 한순화)도 673고지에 대하여 15:00에 공격을 시작하였으나 지형이 불리하여 진전 없이 중지하고 말았다.     8월 14일    이날 제 2대대는 수암산에서 밤에 형성하였던 포위 태세로 05:00에 369고지에 대하여 공격을 전개하였으나 적의 악착같은 저항으로 하루 종일 근접전을 끝에 날이 어두워지면서 공격을 중단하고 말았다.    제 1대대도 원정 부근에서 673고지에 대하여 2차에 걸쳐 공격을 하였으나 역시 성과를 얻지 못하고 원정으로 내려와 재공격을 준비하였다. 그리고 제 3대대는 소학산에 준비된 진지를 ",전쟁기념관,1950.8.13-8.30,"경북 수암산, 유학산","박기병 대령, 한순화 소령, 박병수 소령","한국전쟁사(국방부), 한국전쟁사(전쟁기념사업회)"
100,다부동지구 전투,"상세설명  1. 다부동 지구 전투의 개요      15일간에 걸친 다부동 지구 전투는, 대구로 진출하기 위한 적의 발악적인 공격에 대해 아군이 이 지역을 마지막 방어선으로 사수하기 위한 일보의 양보도 없었던 치열한 전투이다. 이 전투 결과 아군 제 11연대가 적 제 13사단을 격멸하고 거의 Y방어선상에 진출함으로써 대구를 구하게 되었다.      --------------------------------------------------------------------------------  2. 다부동 지구 전투의 주요 지휘관   *아군  제 1사단장 준장 백선엽  제 11연대장 대령 김동빈  제 1대대장 소령 김재명  대위 김소  제 2대대장 소령 이두황  소령 차갑준  제 3대대장 소령 정영홍  병력 제 11연대 2,300여명  장비 105mm포 6문  제 10연대장 중령 고근홍  제 1대대장 소령 박치옥  제 2대대장  제 3대대장  병력 제 10연대 1,500명  제 15연대장 소령 안광영  제 2대대장 중령 이재일(8.21)  병력 제 15연대 2대대 600명  미 제 27연대장 대령 마이켈리스(John H. Michaelis)  병력 2,300명(추정)  장비 105mm포 24문  전차 20대   *적군  제 13사단장 소장 최용진  제 19연대장 대좌 김병철  제 21연대장 대좌 이성준  제 23연대장 대좌 태병열  포병연대장 중좌 정봉욱  병력 제 13사단 13,000명  제 1사단장 소장 홍 림  제 2연대장 대좌 황 석  제 3연대장 대좌 김양춘  제 14연대장 대좌 이창권  포병연대장 대좌 현학봉  병력 제 1사단 5,000명    --------------------------------------------------------------------------------  3. 다부동 지구 전투의 진행과정      가. 전투전의 개황     사단 정면의 우일선을 담당하게 된 제 11연대는 해평 지구에서 지금가지 대적한 바 있는 적 제 13사단과 그리고 군위 지구에서 아군 제 6사단과 전투한 적 제 1사단의 일부병력과 결전을 시도하게 되었다. 지역 내의 신주막은 군위와 신림동, 그리고 대구에 이르는 삼차로로서 그 형태가 Y형을 이루고 있기 때문에 적으로 하여금 분진합격의 가장 좋은 접근로를 제공하여 전차부대로써 대구에 이르는 돌파작전에 유리한 조건을 형성하고 있었다. 뿐만 아니라 사단의 우측인 아군 제 6사단과는 거의 3km에 이르는 간격이 생겨서 적의 침투와 포위의 위협이 있었다. 그러나 사단으로서는 가용한 예비대가 제 15연대 2대대 뿐으로써 군단에서의 증원 없이는 전투지경선 내의 방어선을 형성할 수가 없었다. 따라서 제 11연대는 처음부터 방어임무가 어려운 처지에 놓이게 되었던 것이다.     나. 다부동 지구의 전투     8월 13일    해평 지구에서 12일 야간에 철수를 시작한 제 11연대는 제 15연 2대대(대대장 소령 안광영)의 엄호를 받으면서 상림동을 거쳐 13일 미명에 하판동 신주막 일대에 집결하였다.     8월 14일    아군의 철수를 의심하면서 13일 해평 지구에서 재편성을 끝낸 적 제 13사단은 야간을 이용하여 상림동을 거쳐 14일 미명에 그 선두부대가 상장동 선에 진출하였는데 08:00에는 1개 대대가 여남동에, 그리고 다른 1개 대대가 심곡동 일대에 집결하고 있었다. 적은 08:30에 아군 제 11연대 1대대와 제 15연대 2대대 진지에 대하여 공격을 하여 왔으나 208고지의 제 1대대의 경계 부대는 적을 유도하여 이를 격퇴시켰고, 이때 제 15연대 6중대(중대장 대위 김국주)는 적의 대대장급으로 믿어지는 군관",전쟁기념관,1950.8.13-8.29,경북 왜관,"김동빈 대령, 이두황 소령, 차갑준 소령","한국전쟁사(국방부), 한국전쟁사(전쟁기념사업회)"
101,포남 328고지 전투,"상세설명  1. 포남 328 고지 전투의 개요     적 제 3사단은 328고지를 점령하고자 끈덕진 공격을 감행하였으나 결국 막대한 손실만 입게 되었다. 이 전투로 인해 아군은 영천 쪽으로 진격하게 되어 새로운 전기를 맞게 되었다.      --------------------------------------------------------------------------------  2. 포남 328 고지 전투의 주요 지휘관   *아군  제 1사단장 준장 백선엽  제 15연대장 대령 최영희  제 1대대장 소령 김진위  제 1대대장 소령 류재성  제 2대대장 소령 안광영  제 2대대장 소령 이재일(8. 20 교대)  제 3대대장 소령 최병순  병력: 제 15연대 2,000여명   *적군  제 3사단장 소장 이영호  제 7연대장 미 상  제 8연대장 미 상  보충연대장 미 상  포병연대장 미 상  병력: 3사단 6,000여명    --------------------------------------------------------------------------------  3. 포남 328 고지 전투의 진행과정     8월 14일    약목 일대에서 공격을 준비하던 적 제 3사단의 증강된 1개 연대 병력이 이날 미명에 낙동강을 건너서 강기슭에 배치된 아군 제 15연대 진지로 공격을 감행하여 왔다. 제 1대대(대대장 소령 김진위)와 제 3대대(대대장 소령 최병순)는 포 지원을 받아 적의 도하강행을 막았으나 적의 치열한 포격 때문인지 주진지인 328 고지의 8부 능선으로 물러나 배치를 새로이 하게 되었다. 그러나 적의 수적인 우세와 포격으로 말미암아 손실은 증가되고 더 이상 진지를 유지할 수 없었으므로 14:00경에 이르러 328고지에서 일단 물러나기로 하여 2개 대대는 남쪽의 464고지 선으로 철수를 하였다.    이곳에서 재편성을 끝마치게 된 제1대대와 제 3대대는 곧 특공대를 조직하여 16:00에 105mm포 및 미 공군 전폭기의 지원을 받아가면서 반격을 단행하기 시작하여 21:00에는 328고지를 끝내 탈환하고 적을 강기슭으로 격퇴시키는데 성공하였다.    그러나 제 3대대와 통신이 중단되었기 때문에 연대장은 연대 수색소대를 급히 파견하여 서로 접촉할 수 있도록 하였다. 이리하여 수색소대장(백자근 소위)은 제 3대대의 지휘소를 찾아 지휘하고 있던 대대장에게 파견된 경위를 설명하였다. 제 3대대장은 수색소대의 배속을 원한 나머지 연대장의 승인을 받은 다음 수색소대로 하여금 328고지 좌측 능선을 점령케 하였다. 그러나 밤중에 적이 기습하여 왔기 때문에 수색소대는 육박전을 전개한 끝에 적을 격퇴시켰는데 소대장이 새벽에 살펴보니 아군은 1개분대 사상을 내게 되고 적의 유기시체는 20구가 넘었다.     8월 15일    어제 밤 격퇴당한 적은 이날 미명에 154고지 일대에서 병력을 재수습하여 재차 328고지로 공격을 시도했다. 이리하여 아군은 완강한 저항을 계속하여 정상의 진지를 고수하며 적을 격퇴시키고 말았다. 그러나 약 2개 대대로 추산되는 적은 22:00에 야음을 이용하여 전면적으로 야습을 감행하여 왔으므로 238고지는 적에게 점령당하고 뒤로 물러나 464고지 일대에서병력을 수습하면서 반격을 준비하였다.     8월 16일    328고지를 점령한 적은 진지를 보강중이었으며 미명을 기하여 적 보충연대의 병력이 아군 제 3대대와 좌 인접부대인 미 제 5기병연대의 전투지경선(328고지와 303고지의 개활지)으로 침투하여 아군의 주보급로를 차단하고자 위협하였다. 제 3대대는 미 제 5기병연대의 전차와 포병의 화력지원 하에 반격",전쟁기념관,1950.8.14-8.30,경북 포남,"최영희 대령, 김진위 소령, 류재성 소령","한국전쟁사(국방부), 한국전쟁사(전쟁기념사업회)"
102,포항 탈환전,"상세설명  1. 포항 탈환전의 개요     8월 초 북한군 제 12사단은 안동 동남쪽 산악지대를 이용하여 기계, 안강지구로 침투하고 있으며 유격대인 북한군 제 766부대는 영덕에서 안강지구를 향해 서남쪽으로 진출하고 있었다. 그리고 동해안의 북한군 제 5사단은 영덕에서 해안지대를 따라 계속 남진을 기도하고 있었다.    동해안에서 적의 남하를 힘껏 막아오던 아 제 3사단은 영덕 지역에서 남쪽 10km 지점인 장사동 일대로 전진하여 북한군 제 5사단과 대치중에 있었는데 8월 11일 04:00경에 적 일부 병력이 포항에 침입해 옴으로써 이 사단은 후방이 차단되었으며 또한 측면으로부터의 적의 위협에 직면하게 되었다. 이에 아군은 포항을 지켜내고 형산강을 도하하여 적을 물리침으로써 반격을 개시하게 되었다.    이 포항탈환전은 8월 중순 북한군 제 5사단 수중에 들어갔던 포항을 민기식 부대를 중심으로 다시 탈환한 작전이다.   2. 포항 탈환전의 주요 지휘관   *아군  제 1군단장 소장 김홍일  제 1군단장 준장 김백일(9월 1일부터)  제 3군단 준장 김양원  제 3사단 대령 이종찬(9월 1일부터)  제 22연대장 중령 김응조  제 1대대장 중령 이소동  제 2대대장 중령 정영록  제 3대대장 중령 정순민  제 23연대장 대령 김우영  제 2대대장 대위 최상준  제 대대장 대위 김종병  제 26연대장 중령 이백우  제 26연대장 대령 이치업 (9월 2일부터)  배속부대  제 10연대장 중령 고근홍(9월 6일 원대 복귀)  협동부대  제 1연대장 중령 한신  민부대장 대령 민기식  민 1대대장 소령 손관도  제 2대대장 대위 이창범  미 브래들리 및 잭슨부대  미 해군부대  미 공군부대  병력 약 12600명  장비  81mm 박격포 80문  60mm 박격포 128문  57mm 대전차포 25문  3.5인치 로케트포 47문  2.36인치 로케트포 265문   *적군  제 2군단장 중장 김무정  제 5사단장 소장 마상철  제 10연대장 대좌 박병수  제 11연대장 대좌 김봉문  제 12연대장 미상  제 766부대장 오진우  병력 약 8500명    3. 포항 탈환전의 진행과정     8월 15일 현재 기계와 포항 지구에 침공하였던 북괴 제 12사단 및 제 766부대는 포항지구 전투사령부 예하 제 25연대와 제 17연대 그리고 해군 육전대의 반격으로 일시 북쪽으로 퇴각하고 있었다. 즉, 북한 제 12사단의 일부 병력은 안동 북쪽 3km지점인 165고지에서 아군 제 17연대의 반격을 바고 이 지역 동북방 236고지와 철도 터널 고지로 퇴각하여 안동지역 북쪽과 포항으로 이동 중이었다.    육군본부는 8월 15일에 군예비대(軍豫備隊)로 확보중이던 민 부대를 영천에서 포항방면으로 전진케하여 포항을 탈환하라고 명하였다.     포항지구 전투사령부    육군 본부 작명 116호 (작명 부록 제 5호 참조)에 따라 8월 10일 부로 포항, 기계, 안강 일대에서 적의 공격을 막고 격파하기 위하여 상기 사령부가 설치되었는데 사령관에서는 이정일 (개명 이성가)대령이 임명되었다.    지휘 하에 든 부대는 제 25연대(유해준 중령), 제 17연대(김희준 중령), 제 1유격대대(정진소령), 제 2유격대대(김용주중령), 해군육전대(강기천 소령)과 경찰부대 및 75㎜ 곡사포 1개 중대가 배속되었다. 그리고 8월 11일에 대구에서 새로 편성된 제 26연대(이백우 중령)도 이 사령부의 지휘 밑에 들게 되었다.     민기식 ",전쟁기념관,1950.8.15-8.20,포항,"김응조 중령, 이소동 중령, 정영록 중령","한국전쟁사(국방부), 한국전쟁사(전쟁기념사업회)"
103,왜관 전면 융단폭격작전,"상세설명  1. 왜관 전면융단폭격 작전의 개요     낙동강 방어선에 있어서 왜관 전면융단폭격 작전은 미 제 1기병사단과 한국군 제 1사단이 정면인 왜관 지역에 대한 융단폭격이다.    결과적으로 적이 이미 도하를 한 상태였기 때문에 융단폭격의 효과가 성공적이었다고 할 수는 없지만, 아군의 정면으로부터의 포사격이 현저히 줄었으며, 수백 명의 사상자를 낸 것으로 밝혀졌다.      --------------------------------------------------------------------------------  2. 왜관 전면융단폭격 작전의 주요 지휘관   *아군  극동 공군사령관 중장 스트레이트메이어(Stratemeyer)  미 제 5공군사령관 소장 파트릿지(Earle E. Partridge)  폭격사령관 소장 오도넬(O&#39Donnell)  제 19전대  제 22전대  제 92전대  제 98전대  제 307전대    --------------------------------------------------------------------------------  3. 왜관 전면융단폭격 작전의 진행과정     왜관 동북쪽 303고지의 우단을 경계로 하여 그 우측에 전개한 한국군 제 1사단은 8월 14일 현재 육군본부의 작명에 의하여 Y선을 다음과 같이 점령하고 있어다.  즉 포남동의 270고지, 수암산(519고지), 유학산(839고지), 새술막선에 이르는 20Km정면에 배치되고 있었다.  이날 적의 제 3사단, 15사단, 13사단은 아군 제 1사단 정면에서 각각 중앙돌파를 기도하게 되었다 즉 적은 미 제 1기병사단의 우단인 303고지와 아군 제 1사단의 좌일선인 제 15연대 정면에 적군 제 3사단의 주력이 낙동강을 건너서 압력을 가하여 왔다.    미 제 8군사령부의 정보처에서는 왜관 서북쪽 부근에 적 3개 사단과 105기갑사단이 집결하고 있으며 그 병력은 40,000명 정도로 추산하고 있었다.    아군 제 1사단 12연대 정보과에서도 수색대의 보고를 통하여 연대 정면에 2개 사단이 집결하고 있다는 것을 알게 되었고 연대장을 통하여 백선엽 사단장에게 보고하였으며 사단장은 직접 비행기를 타고 정찰 확인한 뒤에 적정을 육본에 보고하게 되었다.    미 제 1기병사단과 우리 제 1사단의 정보 보고를 받은 미 제 8군으로서는 전 전선에서의 적의 공세로 왜관 정면의 적에 대하여서는 더욱 그 대비책이 궁색하게 되었다.    이때 작전처에서 착상한 것이 제 2차 세계대전 당시에 노르만디(Normandy) 상륙작전에서 쌩로(saint Lo) 지구에 감행한 융단폭격이 생각나서 맥아더(Mac Arthur)사령관에게 건의하게 되었다. 이와 같은 건의를 받은 맥아더 사령관은 극동공군 사령관을 불러서 적의 집결지를 폭격하라고 지시하였다.    이 폭격을 위하여 8월 14일에 개최된 작전회의 석상에서 극동공군사령관은 폭격사령관과 협의하고 다음 몇 가지 사항을 제의하였다.     시각폭격을 할 수 있는 충분한 고도의 필요성  목표지역의 최대면적을 5.8㎢로 할 것.  미 제 8군전선과 폭격선을 평행 시킬 것.  강 폭격선을 명확히 한정한 지형도를 준비할 것.  목표지역내에 최소한 2개~3개 사단의 적이 집결되어 있을 것.  가급적이면 적이 공격준비를 갖추고 있는 지역일 것.      UN군 총사령부는 위의 요청을 신중히 고려하여 목표지역을 선정한 다음 이것을 극동 공군에 통고하였는데 이 지역은 미 제 1기병사단이 담당하고 있는 지역으로서 왜관 맞은편 낙동강의 서쪽 제방과 평행한 12km의 지역이었다.    미 제 1기병 사단장은 적이 이미 도하를 완료하였",전쟁기념관,1950-8.14-8.17,경북 왜관,"소장 파트릿지(Earle E. Partridge) 소장, 오도넬(O&#39Donnell) 소장","한국전쟁사(국방부), 한국전쟁사(전쟁기념사업회)"
104,덕적도-영흥도 확보 작전,"상세설명  1. 덕적도영흥도 확보작전의 개요     인천상륙작전의 초기 거점으로써 덕적도와 영흥도는 그 중요성이 높은 지역이었다. 따라서 아군은 인천상륙작전에 앞서 육전대를 구성하여 덕적도와 영흥도를 확보하는 작전을 펼치게 되었던 것이다.    먼저 덕적도에 상륙하여 적을 소탕한 아군은 이어 영흥도에 상륙하여 장악함으로써 후에 있을 인천상륙작전의 성공에 크게 기여하였다.      --------------------------------------------------------------------------------  2. 덕적도영흥도 확보작전의 주요 지휘관   *아군  미 제 9697기동전대 사령관 중령 루시(M. J. Luosey)  제 1함대 PC-702 함장 중령 이희정  702함 항해장 중위 장근섭    --------------------------------------------------------------------------------  3. 덕적도영흥도 확보작전의 진행과정     적의 지상군은 남으로 진격하면서 연안 부근의 일부 도서까지 점령하였다. 한국 해군은 전 해안을 완전히 봉쇄하였으나, 적 육상포의 탄착거리 내에 있는 해안에 가까운 일부 도서를 부득이 포기할 수밖에 없었다. 적은 연안의 도서를 점령한 다음 발동선과 범선으로 보급을 추진하였으며, 이들 도서를 한국 해군의 동정을 감시하는 거점으로 이용하였다. 특히 적은 각 도서를 점령한 후에 무고한 주민들을 학살하거나 청장년들을 강제로 징집하여 공격의 방패로 삼았다.    한편 한국 해군으로 구성된 제 9697기동전대의 사령관인 미 해군의 루시(M. J. Luosey) 중령은 8월 15일에 적정과 지형정찰, 그리고 기타 필요한 정보 수집을 위한 거점을 확보하기 위하여 서해안의 주요 도서를 탈환하겠다는 뜻을 극동해군 사령부에 건의하였다. 이작전이 승인되자 한국 해군본부는 8월 16일에 제 1함대의 기함인 PC-702 함장 이희정 중령에게 예하 함정(701704함, 513301307309313정)의 승조장병으로 육전대를 편성하여 덕적군도를 점령 확보할 것을 명령하고, 이 작전을 기함 함장의 성을 따서 이작전이라 칭했다.    덕적군도는 그 위치가 인천 접근수로 입구에 있으므로 장차 인천상륙작전에 앞서 절대적으로 확보해야할 거점이었다. 그러나 덕적도에는 1개 소대 약 30명의 적 병력이 주둔하고 있었으며, 통신대가 인천의 적 지상군과 연락을 취하고 있었다. 또한 좌익청년으로 조직된 자위대가 해상감시초소를 운용하고 있었다.    덕적군도 점령의 명령을 받은 이작전부대는 어청도에 집결하여 8월 16일과 17일에 각 함정으로부터 장병 111명을 선발하여 육전대 1개 중대를 편성하였으며, 중대장에는 702함의 항해장인 장근섭 중위가 임명되었다.    8월 18일 06.15시에 상륙부대는 301정과 309정에 분승하여 701702704함과 영국의 경순양함 케냐함 및 캐나다이 구축함 아타바스칸함의 함포지원을 받으며 덕적도 남동쪽에 위치한 상륙지점으로 향하였다. 06.35시에 해안에 무사히 상륙한 상륙부대는 진격을 계속하여 08.00시에 이곳에서 제일 큰 마을인 진리를 완전히 점령하였다. 진리를 포기한 적은 북쪽 산악지대로 도주하였고 상륙부대는 함포지원을 받으며 적을 추격하였다. 그러자 적은 북쪽 해안인 북리로 내려와 발동선 1척으로 탈출을 기도했는데, 상륙부대는 이를 나포하고 14.00시에 덕적도를 완전히 장악하였다.    덕적도의 적을 완전히 소탕한 상륙부대는 대한청년단을 재조직하여 덕적도의 방어와 치안을 담당하게 하고 19일 21.00시에 이",전쟁기념관,1950.8.15-8.24,"경기 덕적도, 영흥도","루시(M. J. Luosey) 중령, 이희정 중령","한국전쟁사(국방부), 한국전쟁사(전쟁기념사업회)"
