행번호,제목,내용,등록자,시기,지역,인물,출처
147,양양-간성 진격전,"상세설명  1. 양양-간성 진격전의 개요     양양-간성 진격전에 있어서 아군 제 3사단(사단장 준장 이종찬)은 적의 강력한 저항을 물리치고 38도 분계선을 넘어 양양으로 돌입, 후방에서 교란전을 펼치는 적을 효과적으로 제압하면서 간성으로 진격하였다.  38도 분계선을 넘어 북진한 아군은 전방으로부터의 저항과 설악산 등지로 은거한 적의 공격을 막아내면서 원산을 향해 계속적으로 진격하였다.      --------------------------------------------------------------------------------  2. 양양-간성 진격전의 주요 지휘관   *아군  제 1군단장 준장 김백일  제 3사단장 준장 이종찬  제 22연대장 중령 김응조  제 1대대장 대위 이창운  제 2대대장 대위 김세락  제 3대대장 소령 정순민  제 23연대장 대령 김종순  제 1대대장 소령 김우영  제 2대대장 소령 최상준  제 3대대장 소령 허형순  제 26연대장 대령 이치업  제 1대대장  제 2대대장  제 3대대장 소령 은석표   배속부대  제 11포병대대장  제 3야전공병대대장  수송 중대장 소령 홍두호  병력: 약 11000명  장비: 60mm 박격포 52문  81mm 박격포 34문  3.5인치 로켓트포 23문  57mm 대전차포 11문  105mm 곡사포 12문   *적군  제 2군단장 중장 김무정  제 5사단장 소장 마상철  병력: 약 7000명  장비: 120mm 박격포 21문  82mm 박격포 70문  122mm 곡사포 5문  장갑차 11대  전차 5대 외 중기 경기 등    --------------------------------------------------------------------------------  3. 양양-간성 진격전의 진행과정     가. 작전계획     본 양양-간성 진격전의 작전 계획은 1군단 작명 제 109호에 의거 수립되었다.   1군단 작명 제 109호  1. 군단은 차기 작전을 용이케 하기 위하여 일부 병력으로써 북진하려 한다. 2. 수도사단장은 즉시 예하부대 병력을 집결시켜 평창-광원리-서림가도를 전진하여 차기 작전을 준비하라. 3. 제 3사단은 현재의 추격을 계속하여 양양을 점령, 확보하는 동시에 수도사단의 38도 분계선 이북 진출을 용이케 하라. 진출 후 양양-인북천의 도로망을 급속히 조사, 보고하라.     이에 따라 제 3사단장은 적을 급속히 추격하여 38도 분계선 개설진지에서 지연됨이 없이 일거 양양을 점령하고 적이 최종적인 결전을 기도하리라고 판단되는 원산을 목표로 북진할 결심을 하였다.     나. 양양-간성의 진격전     10월 1일    이날은 일요일이자 쾌청한 날씨였다. 사단 작명에 따라 사단 선견연대인 제 23연대(연대장 대령 김종순)는 제 3대대(대대장 소령 허형정)를 선두로 05:00에 양양을 목표로 진격하기 시작하였다. 10:00에 제 3대대의 선두가 상구면 영고리에 이르렀을 때, 우측방의 적으로부터 불의의 사격을 받게 되었다. 이곳에서 대대는 1시간여에 걸친 치열한 교전을 전개하여 적 25명을 사살하고 2명을 생포한 외에 기관포 3문, 수냉식 기관총 2정, 체코식 경기관총 2정, 장총 12정, 및 다발총 2정을 노획하는 전과를 거둔 다음 양양에 육박하고 있었다.     10월 2일    이날도 쾌청한 날씨였다. 공격 제대인 제 23연대의 주력 부대는 10:30에 숙영지를 출발하여 14:00에 목표인 양양에 저항 없이 돌입하였으나, 그 곳 뒷산으로부터 적의 경미한 반격이 있었다. 그런데 이 무렵에는 서림-양양 가도를 진격하는 수도사단",전쟁기념관,1950.10.1-10.3,"강원 양양, 간성","이치업 대령, 허형순 소령","한국전쟁사(국방부), 한국전쟁사(전쟁기념사업회)"
148,양구-신고산-안변 진격전,"상세설명  1. 양구-신고산-안변 진격작전의 개요      이 작전은 제 1군단의 선봉사단인 3사단을 후속해서 진격하기로 한 수도사단이 담당했다. 수도사단(사단장 준장 송요찬)은 18연대를 선두로 9월 30일 38도 분계선 부근 2km 지점인 서림에 도착한 후 38도 분계선 돌파의 정치적 결정 때문에 잠시 멈추었다가 이날 밤에 이미 38도 분계선을 돌파하기 시작했다.      --------------------------------------------------------------------------------  2. 양구-신고산-안변 진격작전의 주요 지휘관   *아군  제 1군단장 준장 김백일  수도 사단장 준장 송요찬  제 18연대장 대령 임충식  제 1대대장 소령 장춘권  제 2대대장 소령 김봉상  제 3대대장 소령 안민일  제 1연대장 중령 한 신  제 1대대장 소령 김황목  제 2대대장 소령 신언국  제 3대대장 대위 이성봉  제 1기갑연대장 대령 김남권  제 1대대장 소령 정세진  제 2대대장 소령 박익균  제 3대대장 소령 임권묵  병력: 약 10,000명  장비: 81mm 박격포 24문  60mm 박격포 32문  57mm 대전차포 7문  3.5인치 로켓트포 40문  105mm 곡사포 10문  배속부대  제 10야포대대  수도야전 공병대대   *적군  제 12사단장 소장 최 인  제 5사단장 소장 마상철  병력, 장비 미상    --------------------------------------------------------------------------------  3. 양구-신고산-안변 진격작전의 진행과정     퇴각하는 적 제 51215 사단의 주력은 대화-강릉을 연하는 대관령을 경유하여 오대산으로 잠입한 다음 산맥을 타고 38도 분계선 이북으로 월경하고 있었고, 적의 주력에서 이탈된 후방부대는 대화에서 정북 방향인 창촌-현리를 경유, 인제 부근으로 퇴각하여 38도 분계선 상의 구진지에서 저항선을 치려는 것으로 판단되었다. 수도사단 좌측의 제 68사단 정면의 적까지 합치면 약 2만 명 정도로 추산되었으나 보급정비 상태가 악화되고 사기는 저하되어 있는 것으로 보였다.    한편 수도사단은 적 주력에서 이탈되어 분산된 소수의 잔적들을 제쳐놓고 적의 주력을 추격하기 위해 북진을 감행할 계획이었다. 공격개시 직전에 수도사단 전방지휘소는 평창에 있었으며, 그 예하 18연대는 서림에, 1기갑연대는 창촌에, 1연대는 동사리에 각각 본대가 집결했다. 사단은 군단 작전명령 제 106호에 따라 양양진격을 지시했다. 수도사단에 부여된 임무는 광원리 서림가도를 전진하여 38도 분계선을 돌파하여 양양으로 진격하는 것이었다.    그러나 동사-광원-서림 부근의 지세가 태백산맥의 중복으로 오대산(1,663m), 응복산(1,360m), 계방산(1,677m) 등 험준한 산악연봉을 이루고, 통로마저 비좁아 사단장은 선봉부대인 18연대로 하여금 서림에서 양양에 이르는 비교적 평탄한 기동로를 따라 우선 돌파케 하고, 후속부대인 1기갑연대는 돌파된 진지의 전과확보 및 선두공격부대에 대한 후방경계를 맡도록 했다. 1연대는 사단예비로 있었는데 동사리로 급히 추진시켜 전방부대와는 다른 진격노선인 동사-진부리-대관령-강릉을 경유하여 동해안 도로를 따라 양양 쪽으로 우회 돌진케 했다. 양양을 점령한 이후에는 원산에 대한 집중공격을 위해 3사단과 함께 동일 축선인 동해안 도로를 이용하여 북상할 계획이었다.    작전 제 1일(10. 1.)에 수도사단의 18연대는 38도 분계선을 넘어 철수하는 적의 퇴로를 차단하기 위해 창",전쟁기념관,1950.10.1-10.9,"양구, 안변","임충식 대령, 김남권 대령","한국전쟁사(국방부), 한국전쟁사(전쟁기념사업회)"
149,고성-고저 진격전,"상세설명  1. 고성-고저 진격전의 개요     양양-간성 가도를 따라 후퇴하는 적의 주력 부대를 쫓아 아군 제 3사단(사단장 준장 이종찬)이 북진하며 치른 고성-고저 진격전에서 아군은 곳곳에서 방어선을 형성하고 저항하려는 적과 산지에 은거하며 후방 보급로를 차단하려는 적을 효과적으로 물리치면서 급속도로 북진하였다.    이 과정에서 적의 완강한 저항에 부딪히기도 하였으나 사기가 오른 아군은 1일 평균 24km의 진격속도로 총 연장 168km에 달하는 고저선에 까지 진출하였다.      --------------------------------------------------------------------------------  2. 고성-고저 진격전의 주요 지휘관   *아군  제 1군단장 준장 김백일  제 3사단장 준장 이종찬  제 22연대장 중령 김응조  제 1대대장 대위 이창운  제 2대대장 대위 김세락  제 3대대장 소령 정순민  제 23연대장 대령 김종순  제 1대대장 소령 김우영  제 2대대장 소령 최상준  제 3대대장 소령 허형순  제 26연대장 대령 이치업  제 1대대장  제 2대대장  제 3대대장 소령 은석표   배속부대  제 11포병대대장  제 3야전공병대대장  수송 중대장 소령 홍두호  병력: 약 11000명  장비: 60mm 박격포 52문  81mm 박격포 34문  3.5인치 로켓트포 23문  57mm 대전차포 11문  105mm 곡사포 12문   *적군  제 2군단장 중장 김무정  제 5사단장 소장 마상철  병력: 약 7000명  장비: 120mm 박격포 21문  82mm 박격포 70문  122mm 곡사포 5문  장갑차 11대  전차 5대 외 중기 경기 등    --------------------------------------------------------------------------------  3. 고성-고저 진격전의 진행과정     가. 작전 계획     양양-간성 가도를 따라 후퇴한 적의 주력부대는 고성-통천-고저선에서의 축차 저항을 기도하였고, 그 일부 병력은 오대산, 설악산으로 잠입한 다음, 사단 후방의 보급로를 차단하는 일방 아방의 허점을 찾아 유격전을 전개할 기세를 보였다.    사단장은 양양-간성 진격 작전의 개념에 변함이 없이 퇴각하고 있는 적을 계속 추격하여 일거 원산선으로 돌진하는 즉시로 당면이 적을 포착, 섬멸함과 동시에 철원 방면으로부터 원산에 진출할 것으로 판단되는 적의 퇴로를 차단하기로 하였다.     나. 고성-고저의 진격전     10월 4일    이날은 종일 흐린 날씨가 계속 되었는데, 양양에 주류하고 있던 사단 사령부는 전선의 북상에 따라 이날 간성으로 진출하였다. 제 22연대(연대장 중령 김응조)는 사단 작명에 따라 선두 부대로 마달리를 출발한 다음, 경미한 적의 저항을 물리치면서 고성을 탈환하는 즉시로 급거, 장전으로 육박하고 있었고, 동연대의 공격지원부대인 제 23연대(연대장 대령 김종순)는 거진리선에서 추후 진격하여 제 22연대의 공격을 용이케 함과 동시에 좌측후방이 경계를 담당하고 있었다. 따라서 속초항에 정지하였던 동 연대의 연대본부는 이날 05:00에 속초항을 해로로 출항하여 거진에 상륙하였다.    사단 예비대인 제 26연대(연대장 대령 이치업)는 이날 사단 사령부와 함께 간성에 위치하여 주력 부대의 진출을 돕는 일방, 후방 경계에 임하고 있었다. 한편 포병대대는 계속 각 연대를 직접 지원하였고, 공병대대의 1개 중대는 강릉 비행장의 작업을 계속 하였으며, 2개 중대는 주력 부대에 배속되어 지뢰를 탐지하면",전쟁기념관,1950.10.4-10.7,강원 고성,"이종찬 준장, 김응조 중령","한국전쟁사(국방부), 한국전쟁사(전쟁기념사업회)"
150,원산 탈환 작전,"상세설명  1. 원산탈환 작전의 개요    제 1군단(군단장 소장 김백일)의 원산탈환작전은 10월 8일 통천-회양선에서 시작되었다. 군단 우측의 3사단(사단장 준장 이종찬)은 통천-상음-갈마-원산의 우축선과 괴화리-패천-비운령-안변-원산의 좌축선을, 군단 좌측의 수도사단(사단장 준장 송요찬)은 화천-도납리-안변-원산의 우축선과 회양-신고산-방화리-원산의 우축선등 사개 공격로를 병진하여 10월 10일 미명에 원산 서남쪽의 적 주저항선을 돌파하고 시가를 완전히 점령한 다음, 10월 15일까지에는 송전반도-영흥-고원-신창리-마전리-안변을 연결하는 원산 서북방 30~50km 마제형 외곽을 확보하게 되었다.      --------------------------------------------------------------------------------  2. 원산탈환 작전의 주요 지휘관   *아군  제 1군단장 소장 김백일  제 3사단장 준장 이종찬  제 22연대장 대령 김응조  제 1대대장 대위 이창운  제 2대대장 소령 김세락  제 3대대장 소령 정순민  제 23연대장 대령 김종순  제 1대대장 소령 김우영  제 2대대장 대위 최상준  제 3대대장 소령 허형순  제 26연대장 대령 이치업  제 1대대  제 2대대  제 3대대장 소령 은석표  수도사단장 준장 송요찬  제 1연대장 중령 한 신  제 1대대장 소령 김황목  제 2대대장 소령 신언국  제 3대대장 대위 이성봉  제 1기갑연대장 대령 백남권  제 1대대장 소령 정세진  제 2대대장 대위 박익균  제 3대대장 소령 임권묵  제 18연대장 대령 임충식  제 1대대장 소령 이길영  제 2대대장 소령 김봉상  제 3대대장 소령 안민일  배속부대  제 11포병대대장 소령 송찬호  제 3 야전공병대대  제 10 야포대대  수도야전공병대대  병력: 16,000명  장비: 105mm 곡사포 18문  57mm 대전차포 14문  81mm 박격포 20문  60mm 박격포 25문  3.5인치 로케트포 30문   *적군  제 12사단(재편)  제 10연대  제 11연대  제 12연대  제 13연대  제 42사단(신편)  원산 제 249여단  제 588연대  제 549연대 건설연대  원산 경비 제 2여단  강릉 경비여단, 해군직속 1개 대대  공군 1개 중대  제 24기계화포병여단  제 945해군육군부대  제 1,2,3,4,7,8,15사단의 패잔병  병력: 20,000명  장비 전차 12대  120mm 박격포 8문  76mm 곡사포 3개 대대의 장비  76mm 직사포 27문  122mm 곡사포  82mm 박격포  45mm 대전차포    --------------------------------------------------------------------------------  3. 원산탈환 작전의 진행과정     가. 작전 전 상황     10월 1일부터 9일간 급속한 추격작전을 강행한 제 3사단과 수도사단은 급양이나 후속기동면에서 무리가 있기는 하였으나 육본 작전명령 제 205호의 목표 X&#39인 원산점령을 준비했다. 군단 우익의 제3사단은 22연대가 통천을 점령하고 23연대가 고저를 점령, 송전리선으로 진출하였고, 26연대는 장전에서 괴화리를 향해 진격중에 있었다. 군단 좌측의 수도군단은 회양에서 철령을 넘어 신고산 일대로 진출한 후 안변선까지 진출하여 원산을 남동남서에서 포위하게 되었다. 군단사령부(군단장 소장 김백일)는 고성에 위치했고, 3사단 전방지휘소는 통천, 수도사단 전방지휘소는 회양에 위치하고 있었다.     나. 작전계획     원산탈환을 위한 제 1군단의 작전계획은 이미 10월",전쟁기념관,1950.10.8-10.15,함남 원산,"김백일 소장, 이종찬 준장","한국전쟁사(국방부), 한국전쟁사(전쟁기념사업회)"
151,금천-사리원-황주 진격전,"상세설명  1. 금천-사리원-황주 진격전의 개요    낙동강선으로부터 적을 추격한 미 제 1군단은 9월 26일에 미 제 1기병사단이 경인지구로부터 남진한 미 제 7사단과 오산에서 제휴한 다음, 10월 8일에 개성 일대의 38선지역까지 진격을 완료하였다.      --------------------------------------------------------------------------------  2. 금천-사리원-황주 진격전의 주요 지휘관   *아군  미 제 1군단 장 소장 Frank W. Milburn  미 제 1기병사단 장 소장 Hobart R. Gay  제 5기병연대 장 대령 Marcel B. Crombez  제 2대대 장 중령 Paul Clifford  제 7기병연대 장 대령 William W. Harris  제 1대대 장 중령 Peter D. Clainos  제 2대대 장 중령 Gilomon A. Huff  제 3대대 장 중령 James H. Lynch  제 8기병연대 장 대령 Raymon D. Palmer  제 1대대 장 중령 Robert W. Kane  제 3대대 장 소령 Robert J. Ormond  영 제 27여댄 장 준장 Basil A. Coad  Scotland 대대 장 중령 Neslie Nieloson  Australia 대대 장 중령 Charles H. Green  미 제 24사단 장 소장 John H. Church  제 21연대 장 대령Richard W. Stephens   *적군  제 19사단  제 27사단  제 43사단    --------------------------------------------------------------------------------  3. 금천-사리원-황주 진격전의 진행과정     10월 9일 정오에 정면공격을 담당한 미 제8기병연대(연대장 대령 파머)는 공격을 개시하여 가벼운 저항을 물리치고 북상했는데, 도로상에는 도처에 지뢰가 매설되어 있었기 때문에 전진이 지연되기도 했다. 전차부대는 공병이 지뢰를 제거할 때까지 전진할 수가 없었기 때문에 공격속도는 공병의 지뢰제거속도와 같았다. 그래서 연대가 12일 아침 38선 북방 6km 지점의 두석산에 있는 적과 조우할 때까지의 공격속도는 1일 약 2km에 불과했다.    두석산진지는 북한군이 만 4년 동안 구축한 것이어서 견고했다. 무스탕기 16대의 집중폭격과 155mm 곡사포의 집중포격에도 파괴되지 않았다. 전차와 자주포 및 고사포로도 파괴하기 힘들었다.    우측방의 미 제5기병연대도 10월 9일 아침 장단 부근에서 공격을 개시했는데 험한 산길이라서 진군이 어려워 경미한 저항을 격퇴하면서도 38선에 도달했을 때는 19:30시가 지나서였다. 전면은 바위투성이의 화장산이라 적정을 전혀 알 수 없어서 야간전투의 손실을 피하기 위해 그날 밤은 쉬고 다음날인 10일 아침에 38선을 넘었다. 천마산(752고지)과 화장산(557고지) 사이의 협로는 좌우의 암벽과 낭떠러지로 험난하기 이를 데 없었으나 적의 저항은 의외로 경미하였고, 소수의 경계병이 산발적인 사격을 가하면서 후퇴할 뿐이었다.    다음날인 11일에는 전위대인 제1대대가 화장산 북방의 고지들(179고지, 175고지, 174고지)로 구성된 능선에서 금천 부근으로부터 긴급증원된 것으로 보이는 북한군에게 저지당했다. 그래서 다음날인 12일에야 연대는 전전투력을 투입하여 이를 쟁취했다.    미 제7기병연대는 10월 9일 정오부터 3시간 동안 정면이 800m에 이르는 적 진지에 대해 공격준비사격을 실시하고 15:00시에는 전 화포에 최대발사속도로 사격하면서 예성강을 강습도하(적의 사격을 받으면서 하는 도하)를 시작했다. 최선두의 1개 소대가 적의 소총사격으로 2~3명의 부상자를 내고 재빨리 다리를 건너가 즉시 부근의 적병을 소탕했다. 이어 중대주력이 다리를 건너 주위의 감제고지를 탈취하였고 대대주력이 다리를 건너기 시작",전쟁기념관,1950.10.9-10.17,"금천, 사리원, 황주","밀번 소장(Frank W. Milburn), 팔머 대령(Raymon D. Palmer)","한국전쟁사(국방부), 한국전쟁사(전쟁기념사업회)"
152,철원-곡산 진격전,"상세설명  1. 철원-곡산 진격전의 개요     제 8사단(사단장 준장 이성가)은 38도선을 돌파하여 평양으로 진격하였으나 제 1사단의 평양 입성으로 방향을 바꾸어 곡산-양덕-성천으로 진격하였다.      --------------------------------------------------------------------------------  2. 철원-곡산 진격전의 주요 지휘관  *아군  제 2군단 장 소장 류재흥  제 8사단 장 준장 이성가  제 10연대 장 대령 고근홍  제 16연대 장 대령 유의준  제 21연대 장 대령 김용배  지원부대  제 50 포병대대장 소령 박병주   *적군  제 1사단 장 소장 홍림  (충주-원산-공계-10월 18일경)  제 2사단 장 미상  (춘천-강계-10월 하순)  제 3사단 장 소장 이영호  (다부동-강계-10월 하순)  제12사단 장 소장 최인두  (원주-양덕-강계-10월 하순)  제 15사단 장 소장 조광열  (곡산에서 게릴라-주력은 강계로)    --------------------------------------------------------------------------------  3. 철원-곡산 진격전의 진행과정    중서부전선은 한국군 제2군단(군단장 소장 유재흥)이 맡게 되었다. 그 중 제8사단(사단장 준장 이성가)에게는 육본 작전명령 제205호(작명부록 제6호)에 의거, 제10연대(연대장 대령 고근흥)와 제16연대(연대장 중령 유의준)를 공격제대로 하고, 제21연대(연대장 대령 김용배)를 예비대로 하여 철원-평강선으로 진격하고 계속 북방 또는 서북방으로 진격하게 했다.    제8사단에 내려진 육본 작전명령 제205호는 다음과 같다.   긴급명령  좌측의 제7사단을 이동시킬 때까지는 제7사단과, 그 후로는 우측 제6사단과 협동하여 제2군단장이 지시하는 시각에 북방 및 서북방에 대한 협동공격 개시 제5목표 철원 및 제10목표 평강점령 제1차 진출예정선 점령과 동시에 세포리와 용지원리를 공격할 준비 용지원리 공격에 관해서는 제6사단장과 협의      10월 9일부터 11일간에 제8사단은 철원지역을 완전히 점령 확보하고 계속 평강으로 급진하여 부대를 정비한 후 이천-신계-평양선으로 서북방에 대한 진격준비를 갖추었다. 이날 제2군단 예하 제6사단(사단장 준장 김종오)과 제7사단(사단장 준장 신상철)은 김화를 점령하여 평강으로 진격해 들어갔다. 10월 12일 제8사단 제16연대는 전날 평강까지 급속도로 진격하여 부대정비를 마치고, 복계리로부터 이천 쪽을 향해서 진격을 시작했다. 연대수색중대를 기동정찰부대로 선두에 내세우고 주공은 도로를 중심으로 적의 기습에 대비하면서 진격했다.     10월 13일에 제16연대는 17:00시경 2개 연대병력으로 추산되는 적을 포착하고 피아간 총격전을 벌였다. 적은 아군의 화력포위에 견디지 못하고 지지멸렬되어 곡산 쪽으로 패주하고, 연대는 22:00시경 이천을 점령했다. 10월 14일에도 제10연대는 이천에서 뒤늦게 패주하는 적 패잔병 2개 연대병력을 격파하고, 먼저 진격한 제16연대를 초월해서 신계를 거쳐 곡산으로 향해 진격했다.    제8사단이 38선을 돌파한 후 10월 14일에는 연천-철원-평강-이천선을 따라 신계까지 점령한 후에 평양을 향한 진격을 준비하던 중에 군단장의 새로운 명령이 하달되었다. 그것은 한국군은 제1사단 외에 어느 부대도 평양으로 진격할 수 없으니 제8사단은 평양으로 이르는 진격로를 바꾸어 평양 동북방으로 진격하라.는 것이었다. 이에 따라 사단은 곡산-양덕-성천으로 ",전쟁기념관,1950.10.9-10.18,"철원, 곡산","유의준 대령, 김용배 대령","한국전쟁사(국방부), 한국전쟁사(전쟁기념사업회)"
